{
  "$schema": "./gitops_sop.schema.json",
  "_meta": {
    "purpose": "Comprehensive GitOps SOP and reference matrix for AI Agents generating Hybrid Gitmoji/Conventional Commits, calculating SemVer bumps, generating Changelogs, and handling Releases.",
    "version": "2.0.0",
    "matrix_schema_version": "2.0.0",
    "enforcement": "MANDATORY: Agents MUST ingest these rules and use the embedded matrices for all version control operations to prevent malformed history and corrupted file syntaxes. SemVer and changelog classification MUST be derived from the exact selected intent rows, not broad Conventional Commit cc_type categories."
  },
  "specifications_and_standards": {
    "commit_format": {
      "standard": "Hybrid (Gitmoji + Conventional Commits)",
      "syntax": "<emoji> <cc_type>(<scope>): <subject>",
      "example": "✨ feat(auth): implement OAuth2 login",
      "rules": [
        "The <subject> MUST be imperative, present tense (e.g., 'change' not 'changed' or 'changes').",
        "The <subject> MUST NOT end with a period.",
        "The total length of the subject line MUST NOT exceed 72 characters.",
        "If the diff includes breaking changes, append '!' after the scope: `<emoji> <cc_type>(<scope>)!: <subject>`."
      ]
    },
    "semver_specification": {
      "regex": "^(0|[1-9]\\d*)\\.(0|[1-9]\\d*)\\.(0|[1-9]\\d*)(?:-((?:0|[1-9]\\d*|\\d*[a-zA-Z-][0-zA-Z0-9-]*)(?:\\.(?:0|[1-9]\\d*|\\d*[a-zA-Z-][0-zA-Z0-9-]*))*))?(?:\\+([0-9a-zA-Z-]+(?:\\.[0-9a-zA-Z-]+)*))?$",
      "faq_rules": "v0.x.x is for initial development; the public API should not be considered stable. v1.0.0 defines the public API."
    },
    "version_injection_matrix": {
      "enforcement": "When tasked with versioning a standalone file, the agent MUST use the syntax mapped to the file extension. NEVER inject comments into unsupported formats like JSON. Default to project-level files (e.g., package.json, VERSION) unless executing on a standalone script.",
      "strategies": {
        "json": {
          "extensions": [
            ".json"
          ],
          "method": "root_key",
          "syntax": "\"version\": \"{SEMVER}\"",
          "rule": "DO NOT use comments. Find or create a `version` key at the root object level."
        },
        "hash_comment": {
          "extensions": [
            ".py",
            ".sh",
            ".yaml",
            ".yml",
            ".rb",
            ".conf"
          ],
          "method": "header_comment",
          "syntax": "# version: v{SEMVER}",
          "rule": "Inject or replace on line 1 or 2 of the file."
        },
        "slash_comment": {
          "extensions": [
            ".js",
            ".ts",
            ".c",
            ".cpp",
            ".java",
            ".go"
          ],
          "method": "header_comment",
          "syntax": "// version: v{SEMVER}",
          "rule": "Inject or replace on line 1 or 2 of the file."
        },
        "block_comment": {
          "extensions": [
            ".html",
            ".xml",
            ".md"
          ],
          "method": "header_comment",
          "syntax": "<!-- version: v{SEMVER} -->",
          "rule": "Inject or replace at the top of the document."
        },
        "python_variable": {
          "extensions": [
            ".py"
          ],
          "method": "python_variable",
          "syntax": "__version__ = \"{SEMVER}\"",
          "rule": "Replace __version__ string assignment."
        }
      }
    }
  },
  "agentic_commit_workflow": {
    "philosophy": "Traceable, machine-readable, and visually clear history. Never hallucinate intent.",
    "phases": [
      "Phase 1: Diff Analysis. Execute `git diff` to identify the exact files changed and the nature of the logic altered.",
      "Phase 2: Intent Classification. Determine the PRIMARY intent of the commit. Does it add a feature, fix a bug, or merely refactor?",
      "Phase 3: Matrix Query. Query the `gitmoji_reference_matrix` and select the single most appropriate object based on the `description`.",
      "Phase 4: Subject Line Generation. Format strictly according to `specifications_and_standards.commit_format.syntax`.",
      "Phase 5: Body Generation. If the diff is complex, leave a blank line after the subject and write a detailed body explaining 'Why' and 'What'.",
      "Phase 6: Commit Execution. Execute the commit."
    ]
  },
  "agentic_release_workflow": {
    "philosophy": "Automated, deterministic releases based on semantic commit history and exact SOP intent-row metadata.",
    "phases": [
      "Phase 1: Log Parsing. Read the git commit history since the last SemVer tag. Parse each commit header and, when present, structured secondary intent metadata from `Included changes` and machine-readable trailers.",
      "Phase 2: SemVer Calculation. Evaluate the exact `semver_impact` values from the selected primary and secondary SOP intent rows. The highest impact (MAJOR > MINOR > PATCH > NONE) dictates the bump. Do not infer SemVer impact from broad `cc_type` categories alone.",
      "Phase 3: Target Resolution. Identify the canonical files that receive the version bump (e.g., `pyproject.toml`, `package.json`, `VERSION`, or standalone scripts) according to the release configuration.",
      "Phase 4: File Injection. Use the `version_injection_matrix` and the `semver_regex` to safely find, insert, or update version strings in target files without corrupting syntax.",
      "Phase 5: Changelog Generation. Follow `changelog_generation_rules` to parse primary and secondary commit intents, group them by each selected row's `changelog_group`, and prepend the generated release notes to CHANGELOG.md.",
      "Phase 6: Tag & Release. Commit the version and changelog updates using 🔖 (`:bookmark:`). Create an annotated git tag (`git tag -a v<VERSION> -m 'Release v<VERSION>'`). Suggest or execute the forge CLI command (e.g., `gh release create`) to push the tag and release notes."
    ]
  },
  "changelog_generation_rules": {
    "enforcement": "Do not dump a raw git log. Parse the hybrid commits and group them under markdown headers based on the `changelog_group` mapped in the reference matrix.",
    "taxonomy": [
      "Added: for new features (e.g., ✨ feat).",
      "Changed: for changes in existing functionality (e.g., ♻️ refactor, 🎨 style).",
      "Deprecated: for soon-to-be removed features (e.g., 🗑️).",
      "Removed: for now removed features (e.g., 🔥).",
      "Fixed: for any bug fixes (e.g., 🐛 fix).",
      "Security: in case of vulnerabilities (e.g., 🔒️).",
      "Miscellaneous: for chores, docs, and build updates (e.g., 📝 docs, 🚀 chore)."
    ]
  },
  "semver_resolution_matrix": {
    "MAJOR": "Triggered by explicit breaking-change syntax, a BREAKING CHANGE footer, or any selected primary or secondary intent row whose semver_impact is MAJOR.",
    "MINOR": "Triggered by any selected primary or secondary intent row whose semver_impact is MINOR, unless a MAJOR rule applies.",
    "PATCH": "Triggered by any selected primary or secondary intent row whose semver_impact is PATCH, unless a MAJOR or MINOR rule applies.",
    "NONE": "Applied only when all selected primary and secondary intent rows have semver_impact NONE."
  },
  "commit_language": "en-US",
  "gitmoji_reference_matrix": [
    {
      "emoji": "🎨",
      "code": ":art:",
      "intent_id": "code_structure_formatting",
      "intent_group": "style_assets_text",
      "description": "Improve structure/format of the code",
      "cc_type": "style",
      "semver_impact": "NONE",
      "changelog_group": "Changed",
      "priority": 40,
      "specificity": 45,
      "split_weight": 30,
      "positive_signals": [
        "formatting_only",
        "code_reordered_without_logic_change",
        "whitespace_or_style_cleanup",
        "import_sorting",
        "non_functional_structure_cleanup"
      ],
      "negative_signals": [
        "runtime_logic_changed",
        "new_feature_added",
        "bug_fixed",
        "public_api_changed",
        "security_or_build_change"
      ],
      "selection_rule": "Use when the primary change improves formatting or code structure without changing runtime behaviour."
    },
    {
      "emoji": "⚡️",
      "code": ":zap:",
      "intent_id": "performance_improvement",
      "intent_group": "performance",
      "description": "Improve performance",
      "cc_type": "perf",
      "semver_impact": "PATCH",
      "changelog_group": "Changed",
      "priority": 80,
      "specificity": 75,
      "split_weight": 70,
      "positive_signals": [
        "performance_optimization",
        "latency_reduction",
        "memory_usage_reduction",
        "algorithmic_improvement",
        "benchmark_improvement"
      ],
      "negative_signals": [
        "formatting_only",
        "docs_only",
        "dependency_only",
        "no_runtime_path_changed"
      ],
      "selection_rule": "Use when the dominant user-visible or operational impact is improved speed, latency, throughput, or resource usage."
    },
    {
      "emoji": "🔥",
      "code": ":fire:",
      "intent_id": "remove_code_files",
      "intent_group": "refactor_architecture",
      "description": "Remove code or files",
      "cc_type": "refactor",
      "semver_impact": "PATCH",
      "changelog_group": "Removed",
      "priority": 60,
      "specificity": 75,
      "split_weight": 60,
      "positive_signals": [
        "files_deleted",
        "code_removed",
        "feature_removed_without_deprecation",
        "obsolete_module_removed",
        "large_deletion"
      ],
      "negative_signals": [
        "dead_code_only",
        "deprecation_only",
        "move_or_rename_only",
        "formatting_only",
        "docs_only"
      ],
      "selection_rule": "Use when the primary change actively removes code or files. Prefer ⚰️ for dead-code removal and 🗑️ for deprecation."
    },
    {
      "emoji": "🐛",
      "code": ":bug:",